{
  "$schema": "https://json-schema.org/draft/2020-12/schema",
  "$id": "https://github.com/Cheng-HanHuang/pr_diffusion/schemas/b23/replay_report.schema.json",
  "title": "B23 native-parent replay report",
  "type": "object",
  "additionalProperties": false,
  "required": [
    "schema_version", "experiment_id", "parent_id", "native_run_ids", "wrapper_run_id",
    "eligibility", "determinism_audit", "native_repeatability_envelope",
    "wrapper_comparison", "operation_count_reconciled", "rng_draws_reconciled", "verdict"
  ],
  "properties": {
    "schema_version": {"const": "b23.replay-report.v1"},
    "experiment_id": {"type": "string", "minLength": 1},
    "parent_id": {"enum": ["Fresh1", "LF-v1", "NP-1", "SITCOM-1"]},
    "native_run_ids": {"type": "array", "items": {"type": "string", "minLength": 1}, "minItems": 2, "uniqueItems": true},
    "wrapper_run_id": {"type": ["string", "null"]},
    "eligibility": {"enum": ["BITWISE", "TOLERANCE_QUALIFIED"]},
    "eligibility_rationale": {"type": "string"},
    "determinism_audit": {
      "type": "object",
      "additionalProperties": false,
      "required": ["torch_deterministic_algorithms", "cudnn_deterministic", "cudnn_benchmark", "cublas_workspace_config", "flags_change_native_parent"],
      "properties": {
        "torch_deterministic_algorithms": {"type": ["boolean", "null"]},
        "cudnn_deterministic": {"type": ["boolean", "null"]},
        "cudnn_benchmark": {"type": ["boolean", "null"]},
        "cublas_workspace_config": {"type": ["string", "null"]},
        "flags_change_native_parent": {"type": ["boolean", "null"]},
        "notes": {"type": "array", "items": {"type": "string"}}
      }
    },
    "native_repeatability_envelope": {"$ref": "#/$defs/comparison"},
    "wrapper_comparison": {"$ref": "#/$defs/comparison"},
    "native_operation_counts_sha256": {"type": ["string", "null"], "pattern": "^[0-9a-f]{64}$"},
    "wrapper_operation_counts_sha256": {"type": ["string", "null"], "pattern": "^[0-9a-f]{64}$"},
    "operation_count_reconciled": {"type": "boolean"},
    "native_rng_ledger_sha256": {"type": ["string", "null"], "pattern": "^[0-9a-f]{64}$"},
    "wrapper_rng_ledger_sha256": {"type": ["string", "null"], "pattern": "^[0-9a-f]{64}$"},
    "rng_draws_reconciled": {"type": "boolean"},
    "serialization_resume_check": {"enum": ["PASS", "FAIL", "NOT_APPLICABLE", "NOT_RUN"]},
    "verdict": {"enum": ["PASS", "FAIL", "NOT_RUN"]},
    "failure_reasons": {"type": "array", "items": {"type": "string"}}
  },
  "$defs": {
    "metric": {"type": ["number", "null"], "minimum": 0},
    "comparison": {
      "type": "object",
      "additionalProperties": false,
      "required": ["max_abs_err", "mean_abs_err", "relative_l2_err", "raw_psnr_delta", "measurement_loss_delta", "trace_max_abs_err", "tensor_hash_equal"],
      "properties": {
        "max_abs_err": {"$ref": "#/$defs/metric"},
        "mean_abs_err": {"$ref": "#/$defs/metric"},
        "relative_l2_err": {"$ref": "#/$defs/metric"},
        "raw_psnr_delta": {"type": ["number", "null"]},
        "measurement_loss_delta": {"type": ["number", "null"]},
        "trace_max_abs_err": {"$ref": "#/$defs/metric"},
        "tensor_hash_equal": {"type": ["boolean", "null"]}
      }
    }
  }
}
