{
  "schema_version": "b23.replay-report.v1",
  "experiment_id": "B23_0_SCHEMA_EXAMPLE",
  "parent_id": "Fresh1",
  "native_run_ids": ["NOT_RUN_NATIVE_1", "NOT_RUN_NATIVE_2"],
  "wrapper_run_id": null,
  "eligibility": "TOLERANCE_QUALIFIED",
  "eligibility_rationale": "Placeholder only; B23.1 native repeats determine eligibility.",
  "determinism_audit": {"torch_deterministic_algorithms": null, "cudnn_deterministic": null, "cudnn_benchmark": null, "cublas_workspace_config": null, "flags_change_native_parent": null, "notes": ["Not executed in B23.0"]},
  "native_repeatability_envelope": {"max_abs_err": null, "mean_abs_err": null, "relative_l2_err": null, "raw_psnr_delta": null, "measurement_loss_delta": null, "trace_max_abs_err": null, "tensor_hash_equal": null},
  "wrapper_comparison": {"max_abs_err": null, "mean_abs_err": null, "relative_l2_err": null, "raw_psnr_delta": null, "measurement_loss_delta": null, "trace_max_abs_err": null, "tensor_hash_equal": null},
  "native_operation_counts_sha256": null,
  "wrapper_operation_counts_sha256": null,
  "operation_count_reconciled": false,
  "native_rng_ledger_sha256": null,
  "wrapper_rng_ledger_sha256": null,
  "rng_draws_reconciled": false,
  "serialization_resume_check": "NOT_RUN",
  "verdict": "NOT_RUN",
  "failure_reasons": []
}
